{
  "schema_version": 1,
  "code": "RECOVERY_COMPLETED",
  "status": "complete",
  "sessions_discovered": 1,
  "sessions_recovered": 1,
  "key_loss_verified_sessions": 1,
  "base_images_verified": true,
  "artifacts_discovered": {
    "qemu_process": 1,
    "cgroup": 1,
    "qmp_socket": 1,
    "spice_socket": 1,
    "vsock_cid": 1,
    "tap": 1,
    "veth": 1,
    "network_namespace": 1,
    "nftables": 1,
    "usb_claim": 1,
    "outer_mount": 1,
    "device_mapper": 1,
    "loop_device": 1,
    "ciphertext": 1,
    "runtime_path": 1
  },
  "artifacts_recovered": {
    "qemu_process": 1,
    "cgroup": 1,
    "qmp_socket": 1,
    "spice_socket": 1,
    "vsock_cid": 1,
    "tap": 1,
    "veth": 1,
    "network_namespace": 1,
    "nftables": 1,
    "usb_claim": 1,
    "outer_mount": 1,
    "device_mapper": 1,
    "loop_device": 1,
    "ciphertext": 1,
    "runtime_path": 1
  },
  "failures": []
}
